{
  "guid": "lua ",
  "name": "Lua Script",
  "short_description": "Algorithm defined by a Lua script",
  "description": "This algorithm allows you to run what are effectively scripted \"plug-ins\", loaded from the MicroSD card. Such scripts are ideal for CV processing, especially for quirky little sequencers or generative things that are never going to be implemented as official algorithms because they're so specific to your particular use case. Scripts are not intended for audio processing. If you want to implement custom DSP code, look at the Three Pot algorithm (below) or the C++ API (above).",
  "categories": [
    "CV Processing",
    "Sequencing",
    "Generative",
    "Scripting"
  ],
  "parameters": [
    {
      "name": "Program",
      "min": 0,
      "max": 999,
      "default": 0,
      "description": "Selects the program to run."
    }
  ],
  "input_ports": [],
  "output_ports": [
    {
      "name": "Output",
      "description": "Routing parameters are entirely defined by the script, and relate the script's inputs and outputs to the system busses."
    }
  ]
}