{
  "guid": "absv",
  "name": "Rectifier",
  "short_description": "Full-wave rectifier/absolute value",
  "description": "This simple algorithm computes the absolute value of the input voltage.",
  "categories": [
    "Signal Processing",
    "Math",
    "Wave Shaping"
  ],
  "parameters": [
    {
      "name": "Enable",
      "min": 0,
      "max": 1,
      "default": 0,
      "description": "Enables the channel. Disabled channels have no effect on the bus."
    },
    {
      "name": "Output mode",
      "min": 0,
      "max": 1,
      "default": 1,
      "description": "The standard Add/Replace mode selector as described above."
    }
  ],
  "input_ports": [
    {
      "name": "Input",
      "description": "The input bus to process."
    }
  ],
  "output_ports": [
    {
      "name": "Output",
      "description": "The output bus. If set to 'None', the input bus is used as output, and the mode is always 'Replace'."
    }
  ]
}