{
  "guid": "spin",
  "name": "Three Pot",
  "short_description": "Runs DSP code from the SD card",
  "description": "This algorithm allows you to run what are effectively DSP \"plug-ins\", loaded from the MicroSD card. It was designed particularly to support programs written for the Spin Semiconductor FV-1 chip. Although the focus is on converted FV-1 programs, the conversion works by translating the programs to C++ and then compiling them for the disting NT – so you can if you like actually write C++ directly and use this algorithm to run it on the module.",
  "categories": [
    "DSP",
    "Plugin",
    "Effect"
  ],
  "use_cases": [
    "Running FV-1 DSP programs converted to 3pot format",
    "Running custom C++ DSP code on the disting NT",
    "Using open source Spin Semiconductor DSP programs"
  ],
  "gui_description": "The UI provides a custom display showing the program name, pot labels, and description (all from the 3pot file if provided). The three physical pots on the module control the three pot parameters directly. The right encoder changes the program. While selecting a new program, the whole display is given over to showing the program description.",
  "specifications": [
    {
      "name": "Code memory",
      "min": 1,
      "max": 24
    },
    {
      "name": "Code memory unit",
      "description": "in multiples of 512 bytes"
    }
  ],
  "parameters": [
    {
      "name": "Program",
      "min": 0,
      "max": 999,
      "default": 0,
      "description": "Selects the program to run."
    },
    {
      "name": "Pot 1",
      "min": 0.0,
      "max": 100.0,
      "default": 50.0,
      "is_bus": false,
      "description": "The first program ‘pot’ parameter.",
      "unit": "%"
    },
    {
      "name": "Pot 2",
      "min": 0.0,
      "max": 100.0,
      "default": 50.0,
      "is_bus": false,
      "description": "The second program ‘pot’ parameter.",
      "unit": "%"
    },
    {
      "name": "Pot 3",
      "min": 0.0,
      "max": 100.0,
      "default": 50.0,
      "is_bus": false,
      "description": "The third program ‘pot’ parameter.",
      "unit": "%"
    },
    {
      "name": "Pre/post gain",
      "min": -36,
      "max": 0,
      "default": -20,
      "is_bus": false,
      "description": "Sets the gain adjustment applied before the program’s DSP code. See above.",
      "unit": "dB"
    },
    {
      "name": "Mix style",
      "min": 0,
      "max": 2,
      "default": 0,
      "is_bus": false,
      "description": "Chooses the dry/wet mix style: ‘None’, ‘Wet/dry’, or ‘Independent’."
    },
    {
      "name": "Mix",
      "min": 0,
      "max": 100,
      "default": 100,
      "is_bus": false,
      "description": "Sets the mix if the style is ‘Wet/dry’.",
      "unit": "%"
    },
    {
      "name": "Dry gain",
      "min": -40,
      "max": 24,
      "default": -40,
      "is_bus": false,
      "description": "Sets the dry gain if the mix style is ‘Independent’.",
      "unit": "dB"
    },
    {
      "name": "Wet gain",
      "min": -40,
      "max": 24,
      "default": 0,
      "is_bus": false,
      "description": "Sets the wet gain if the mix style is ‘Independent’.",
      "unit": "dB"
    },
    {
      "name": "Rate conversion",
      "min": 0,
      "max": 1,
      "default": 0,
      "is_bus": false,
      "description": "Enables sample rate conversion."
    },
    {
      "name": "Sample rate",
      "min": 8.0,
      "max": 40.0,
      "default": 32.0,
      "is_bus": false,
      "description": "The sample rate (in kHz) at which to run the program."
    },
    {
      "name": "Output mode",
      "min": 0,
      "max": 1,
      "default": 0,
      "is_bus": false,
      "description": "The standard Add/Replace mode selector as described above."
    }
  ],
  "input_ports": [
    {
      "name": "Left input",
      "description": "The left audio input bus."
    },
    {
      "name": "Right input",
      "description": "The right audio input bus."
    }
  ],
  "output_ports": [
    {
      "name": "Left output",
      "description": "The left audio output bus."
    },
    {
      "name": "Right output",
      "description": "The right audio output bus."
    }
  ]
}
