{
  "guid": "wavs",
  "name": "Waveshaper",
  "short_description": "Waveshaper/wavefolder",
  "description": "This algorithm is based on the Dual Waveshaper algorithm on the disting mk4. Type 0 is what is usually termed a wavefolder. This increases the harmonic content of the sound in interesting ways, especially as the gain changes. Type 1 is a triangle-to-sine waveshaper. Used on most audio this is a relatively gentle form of overdrive/saturation. However, when fed with the right level of triangle wave, the output is exactly a sine wave, which is useful when you have a triangle wave VCO handy but really want a pure sine wave instead.",
  "categories": [
    "Distortion",
    "Waveshaping",
    "Overdrive"
  ],
  "use_cases": [
    "Adding harmonic content to sounds via wavefolding",
    "Converting triangle waves to pure sine waves",
    "Gentle overdrive/saturation of audio signals"
  ],
  "gui_description": "The display shows how an input sine wave will be affected by the waveshaper. It is not an oscilloscope – it's not showing what your actual audio looks like (unless you happen to be feeding it a sine wave). It's just a graphical aid to get an idea of how much waveshaping is being applied.",
  "parameters": [
    {
      "name": "Input gain",
      "min": -32.0,
      "max": 32.0,
      "default": 1.0,
      "description": "The input gain. Negative values invert the signal."
    },
    {
      "name": "Mode",
      "min": 0,
      "max": 1,
      "default": 0,
      "description": "The waveshaping mode: 'Wavefolder' or 'Tri-to-sine shaper'.",
      "enum_values": [
        "Wavefolder",
        "Tri-to-sine shaper"
      ]
    },
    {
      "name": "Mix",
      "min": 0,
      "max": 100,
      "default": 100,
      "defaultValue": 100,
      "description": "The output wet/dry mix.",
      "unit": "%"
    },
    {
      "name": "Level",
      "min": -40,
      "max": 0,
      "default": 0,
      "description": "The output gain applied to the shaped signal.",
      "unit": "dB"
    },
    {
      "name": "Width",
      "min": 1,
      "max": 8,
      "default": 1,
      "description": "The number of busses to process, starting from the Input. For example, for a stereo signal, set this to 2."
    },
    {
      "name": "Output mode",
      "min": 0,
      "max": 1,
      "default": 0,
      "description": "The standard Add/Replace mode selector as described above.",
      "enum_values": [
        "Add",
        "Replace"
      ]
    }
  ],
  "input_ports": [
    {
      "name": "Input",
      "description": "The first input bus to process."
    },
    {
      "name": "Gain input",
      "description": "The bus to use to control the input gain. Scaled such that a 5V CV gives 32x gain."
    }
  ],
  "output_ports": [
    {
      "name": "Output",
      "description": "The first output bus."
    }
  ]
}
