{
  "guid": "wavr",
  "name": "Audio recorder",
  "short_description": "Records audio to the MicroSD card",
  "description": "This algorithm records WAV files to the MicroSD card. A typical use for this would be to record the module's inputs, but any bus can be the source for a recording, so you could also record the output of other algorithms – for example, you could run a mixer and record the stereo mix-down.\n\nThe algorithm can also play back its recordings. It does so to the same bus channels as are chosen for recording.\n\nSince the module is fully DC-coupled, it can also record and play CVs.\n\nUp to 10 files can be recorded simultaneously, each mono or stereo. It goes without saying that the more files you record, and the larger the chosen bit depth, the more demands are placed on the MicroSD card. You would be advised to check your card performance before relying on the algorithm for any crucial recordings.",
  "categories": [
    "Recording",
    "Playback"
  ],
  "parameters": [
    {
      "name": "Record",
      "min": 0,
      "max": 1,
      "default": 0,
      "description": "Starts/stops recording."
    },
    {
      "name": "Play",
      "min": 0,
      "max": 1,
      "default": 0,
      "description": "Starts/stops playback."
    },
    {
      "name": "Record lock",
      "min": 0,
      "max": 1,
      "default": 0,
      "description": "If on, changes to the Record parameter are ignored."
    },
    {
      "name": "Play lock",
      "min": 0,
      "max": 1,
      "default": 0,
      "description": "If on, changes to the Play parameter are ignored."
    },
    {
      "name": "Bit depth",
      "min": 0,
      "max": 2,
      "default": 0,
      "description": "Chooses the bit depth for recording. The options are 16, 24, or 32 bit.",
      "enum_values": [
        "16",
        "24",
        "32"
      ]
    },
    {
      "name": "Normalisation",
      "min": 0,
      "max": 1,
      "default": 0,
      "description": "Sets the voltage that corresponds to full-scale in the recorded files. The options are 10V or 12V. Applies to both recording and playback.",
      "enum_values": [
        "10V",
        "12V"
      ]
    },
    {
      "name": "Which recording",
      "description": "Selects the recording to play."
    },
    {
      "name": "Gain",
      "min": -40,
      "max": 24,
      "default": 0,
      "type": "scaled",
      "is_bus": false,
      "description": "Sets the playback level.",
      "unit": "dB"
    },
    {
      "name": "Enable",
      "min": 0,
      "max": 1,
      "default": 0,
      "description": "Enables the file for recording and playback."
    },
    {
      "name": "Playback",
      "min": 0,
      "max": 1,
      "default": 1,
      "description": "Enables the file for playback. (Both 'Enable' and 'Playback' must be on for the file to be included in playback.)"
    }
  ],
  "input_ports": [
    {
      "name": "Left/mono input",
      "description": "Sets the left or mono channel to record."
    },
    {
      "name": "Right input",
      "description": "Sets the right channel to record."
    }
  ],
  "output_ports": [
    {
      "name": "Output",
      "description": "Plays back recordings to the selected bus channels."
    }
  ]
}
