{
  "guid": "dels",
  "name": "Delay (Stereo)",
  "short_description": "A simple stereo delay effect",
  "description": "This algorithm is a simple stereo in/stereo out delay effect. The delay time can be set manually, via a clock pulse, or via MIDI clock. It can also be modulated via its 'V/oct input', which halves the delay time for every 1V rise in CV (conversely, doubles it for every 1V fall in CV). The 'Fractional' parameter allows for delay times that are not integer multiples of the sample rate. This slightly increases CPU load but will sound significantly better if the delay time is being modulated, for example for chorus or flange type sounds. Conversely, turning it off makes for an extremely clean digital delay, with no colouration in the repeats.",
  "categories": [
    "Delay",
    "Stereo",
    "Effect"
  ],
  "use_cases": [
    "Stereo delay",
    "Chorus",
    "Flange",
    "Ping-pong delay"
  ],
  "specifications": [
    {
      "name": "Max delay time",
      "value": "1-30 seconds",
      "description": "The maximum delay time."
    }
  ],
  "parameters": [
    {
      "name": "Mode",
      "min": 0,
      "max": 2,
      "default": 0,
      "type": "enum",
      "isCommon": false,
      "is_bus": false,
      "description": "The delay mode. The options are “Stereo”, “Stereo ping-pong” (each echo swaps left and right), and “Ping-pong” (the input to the delay is summed to mono, panned, and then swaps left and right on each echo)."
    },
    {
      "name": "Mix",
      "min": 0,
      "max": 100,
      "default": 100,
      "isCommon": false,
      "is_bus": false,
      "description": "The wet/dry mix.",
      "unit": "%"
    },
    {
      "name": "Level",
      "min": -40,
      "max": 0,
      "default": 0,
      "isCommon": false,
      "is_bus": false,
      "description": "The gain applied to the delay/wet signal.",
      "unit": "dB"
    },
    {
      "name": "Time",
      "min": 1,
      "max": 32767,
      "default": 250,
      "isCommon": false,
      "is_bus": false,
      "description": "The delay time.",
      "unit": "ms"
    },
    {
      "name": "Feedback",
      "min": 0,
      "max": 100,
      "default": 50,
      "isCommon": false,
      "is_bus": false,
      "description": "The delay feedback.",
      "unit": "%"
    },
    {
      "name": "Initial pan",
      "min": -100,
      "max": 100,
      "default": -100,
      "isCommon": false,
      "is_bus": false,
      "description": "If the mode is “Ping-pong”, sets the pan position of the first delay.",
      "unit": "%"
    },
    {
      "name": "Delay multiplier",
      "min": 0,
      "max": 23,
      "default": 15,
      "isCommon": false,
      "is_bus": false,
      "description": "Sets a multiplier to apply to the delay time. Affects both the ‘Time’ parameter and the delay time set by the clock."
    },
    {
      "name": "Time change",
      "min": 0,
      "max": 1,
      "default": 0,
      "type": "enum",
      "isCommon": false,
      "is_bus": false,
      "description": "Sets how changes of delay time will be handled. The options are ‘Slew’ (the delay time is smoothly interpolated, sounding a bit like a tape being played slower or faster) and ‘Crossfade’ (the effect rapidly crossfades from one time setting to the other)."
    },
    {
      "name": "Fractional",
      "min": 0,
      "max": 1,
      "default": 0,
      "isCommon": false,
      "is_bus": false,
      "description": "Enables fractional delay times. See above."
    },
    {
      "name": "Block DC",
      "min": 0,
      "max": 1,
      "default": 1,
      "isCommon": false,
      "is_bus": false,
      "description": "Enables a DC blocker at the delay input. Recommended for audio use; disable when processing CVs."
    },
    {
      "name": "Clock source",
      "min": 0,
      "max": 2,
      "default": 1,
      "type": "enum",
      "isCommon": false,
      "is_bus": false,
      "description": "Chooses the clock source: ‘None’, ‘Clock input’, or ‘MIDI clock’."
    },
    {
      "name": "MIDI divisor",
      "min": 0,
      "max": 19,
      "default": 9,
      "isCommon": false,
      "is_bus": false,
      "description": "The MIDI divisor, if the clock source is ‘MIDI clock’."
    },
    {
      "name": "MIDI numerator",
      "min": 1,
      "max": 16,
      "default": 1,
      "isCommon": false,
      "is_bus": false,
      "description": "The MIDI numerator, if the clock source is ‘MIDI clock’."
    },
    {
      "name": "Output mode",
      "min": 0,
      "max": 1,
      "default": 0,
      "type": "enum",
      "isCommon": false,
      "is_bus": false,
      "description": "The standard Add/Replace mode selector as described above."
    }
  ],
  "input_ports": [
    {
      "name": "Left input",
      "description": "The left input bus."
    },
    {
      "name": "Right input",
      "description": "The right input bus."
    },
    {
      "name": "V/oct input",
      "description": "The input bus to use for 1V/octave modulation of the delay time."
    },
    {
      "name": "Clock input",
      "description": "The input bus to use for the clock, if the source is ‘Clock input’."
    }
  ],
  "output_ports": [
    {
      "name": "Left output",
      "description": "The left output bus."
    },
    {
      "name": "Right output",
      "description": "The right output bus."
    }
  ]
}
