{
  "guid": "pym2",
  "name": "Poly Macro Oscillator 2",
  "short_description": "It's lots of Plaits!",
  "description": "This algorithm is a polysynth where each voice is essentially a Plaits (the open source Plaits module by Émilie Gillet). Please refer to the section \"Common polysynth features\" above.",
  "categories": [
    "oscillator",
    "polysynth",
    "synthesis"
  ],
  "use_cases": [
    "polyphonic synthesis",
    "MPE performance",
    "microtuning"
  ],
  "gui_description": "The display shows the notes being played by the various voices. Note that Plaits voices never really end – in theory they decay forever.",
  "specifications": [
    {
      "name": "Voices",
      "min": 1,
      "max": 8
    }
  ],
  "parameters": [
    {
      "name": "Model",
      "min": 0,
      "max": 23,
      "default": 0,
      "description": "Chooses the synthesis model."
    },
    {
      "name": "Coarse tune",
      "min": -60,
      "max": 60,
      "default": 0,
      "is_bus": false,
      "description": "Coarse tuning control.",
      "unit": "ST"
    },
    {
      "name": "Fine tune",
      "min": -100,
      "max": 100,
      "default": 0,
      "is_bus": false,
      "description": "Fine tuning control.",
      "unit": "cents"
    },
    {
      "name": "Harmonics",
      "min": 0,
      "max": 127,
      "default": 64,
      "is_bus": false,
      "description": "Sets the harmonics control."
    },
    {
      "name": "Timbre",
      "min": 0,
      "max": 127,
      "default": 64,
      "is_bus": false,
      "description": "Sets the timbre control."
    },
    {
      "name": "Morph",
      "min": 0,
      "max": 127,
      "default": 64,
      "is_bus": false,
      "description": "Sets the morph control."
    },
    {
      "name": "FM",
      "min": -100,
      "max": 100,
      "default": 0,
      "is_bus": false,
      "description": "Sets the FM depth.",
      "unit": "%"
    },
    {
      "name": "Timbre mod",
      "min": -100,
      "max": 100,
      "default": 0,
      "is_bus": false,
      "description": "Sets the timbre modulation depth.",
      "unit": "%"
    },
    {
      "name": "Morph mod",
      "min": -100,
      "max": 100,
      "default": 0,
      "is_bus": false,
      "description": "Sets the morph modulation depth.",
      "unit": "%"
    },
    {
      "name": "Low-pass gate",
      "min": 0,
      "max": 127,
      "default": 127,
      "is_bus": false,
      "description": "Sets the LPG colour (VCFA-VCA blend)."
    },
    {
      "name": "Time/decay",
      "min": 0,
      "max": 127,
      "default": 64,
      "is_bus": false,
      "description": "Sets the envelope decay time."
    },
    {
      "name": "Output mode",
      "min": 0,
      "max": 1,
      "default": 0,
      "is_bus": false,
      "description": "The standard Add/Replace mode selector as described above."
    },
    {
      "name": "Main gain",
      "min": -40,
      "max": 6,
      "default": 0,
      "is_bus": false,
      "description": "The level of the ‘Main’ output signal.",
      "unit": "dB"
    },
    {
      "name": "Aux gain",
      "min": -40,
      "max": 6,
      "default": 0,
      "is_bus": false,
      "description": "The level of the ‘Aux’ output signal.",
      "unit": "dB"
    },
    {
      "name": "MIDI channel",
      "min": 0,
      "max": 16,
      "default": 1,
      "is_bus": false,
      "description": "The MIDI channel to listen on."
    },
    {
      "name": "MPE channels",
      "min": 1,
      "max": 16,
      "default": 1,
      "is_bus": false,
      "description": "Controls how the algorithm will respond to MPE. See above."
    },
    {
      "name": "I2C channel",
      "min": 0,
      "max": 255,
      "default": 1,
      "is_bus": false,
      "description": "Sets the I2C channel."
    },
    {
      "name": "Bend range",
      "min": 0,
      "max": 48,
      "default": 2,
      "is_bus": false,
      "description": "The MIDI pitch bend range."
    },
    {
      "name": "Sustain mode",
      "min": 0,
      "max": 1,
      "default": 0,
      "is_bus": false,
      "description": "The standard polysynth sustain mode parameter. See above."
    },
    {
      "name": "Sustain",
      "min": 0,
      "max": 1,
      "default": 0,
      "is_bus": false,
      "description": "Directly controls the sustain (like a MIDI sustain pedal)."
    },
    {
      "name": "Press -> volume",
      "min": -100,
      "max": 100,
      "default": 0,
      "is_bus": false,
      "description": "The amount by which pressure (per note for MPE) affects the note volume.",
      "unit": "%"
    },
    {
      "name": "Press -> harmonics",
      "min": -127,
      "max": 127,
      "default": 0,
      "is_bus": false,
      "description": "The amount by which pressure (per note for MPE) affects the harmonics."
    },
    {
      "name": "Press -> timbre",
      "min": -127,
      "max": 127,
      "default": 0,
      "is_bus": false,
      "description": "The amount by which pressure (per note for MPE) affects the timbre."
    },
    {
      "name": "Press -> morph",
      "min": -127,
      "max": 127,
      "default": 0,
      "is_bus": false,
      "description": "The amount by which pressure (per note for MPE) affects the morph."
    },
    {
      "name": "MPE Y -> volume",
      "min": -100,
      "max": 100,
      "default": 0,
      "is_bus": false,
      "description": "The amount by which the MPE Y dimension affects the note volume.",
      "unit": "%"
    },
    {
      "name": "MPE Y -> harmonics",
      "min": -127,
      "max": 127,
      "default": 0,
      "is_bus": false,
      "description": "The amount by which the MPE Y dimension affects the harmonics."
    },
    {
      "name": "MPE Y -> timbre",
      "min": -127,
      "max": 127,
      "default": 0,
      "is_bus": false,
      "description": "The amount by which the MPE Y dimension affects the timbre."
    },
    {
      "name": "MPE Y -> morph",
      "min": -127,
      "max": 127,
      "default": 0,
      "is_bus": false,
      "description": "The amount by which the MPE Y dimension affects the morph."
    }
  ],
  "input_ports": [
    {
      "name": "Level input",
      "description": "Selects which bus is used as the level input."
    },
    {
      "name": "FM input",
      "description": "Selects which bus is used as the FM input."
    },
    {
      "name": "Harmonics input",
      "description": "Selects which bus is used as the harmonics input."
    },
    {
      "name": "Timbre input",
      "description": "Selects which bus is used as the timbre input."
    },
    {
      "name": "Morph input",
      "description": "Selects which bus is used as the morph input."
    }
  ],
  "output_ports": [
    {
      "name": "Main output",
      "description": "The bus for the ‘Main’ output."
    },
    {
      "name": "Aux output",
      "description": "The bus for the ‘Aux’ output."
    }
  ]
}
