{
  "guid": "env2",
  "name": "Envelope (AR/AD)",
  "short_description": "A simple attack/release envelope",
  "description": "This algorithm generates simple attack/release or attack/decay envelopes. It is based on the disting mk4 algorithm \"E-1 AR Envelope\". In the disting mk4 version the envelope times were always set together from a single knob; this version adds the option of setting them independently. The envelope times and shapes are set globally; each output channel can however be independently scaled and offset. In \"Attack/release\" mode, the envelope will rise to full level and stay there as long as the input is high. In \"Attack/decay\" mode, the envelope will execute one full attack/decay cycle in response to a trigger input. In \"Looped AD\" mode, the envelope will continually execute attack/decay cycles as long as the trigger input is high. In \"Macro (asymmetric)\" mode, the \"Joint time\" parameter sweeps from short A & D, through short A & long D, through long A & D, through long A & short D, and finally back to short A & D. In \"Macro (symmetric)\" mode, the \"Joint time\" parameter sets the A & D times to the same value, from very short times (about 10ms) to very long times (about 8s). Note that the actual times are heavily dependent on the shape parameters.",
  "categories": [
    "Envelope",
    "Modulation",
    "Signal Generation"
  ],
  "parameters": [
    {
      "name": "Trigger mode",
      "min": 0,
      "max": 2,
      "default": 0,
      "type": "enum",
      "isPerChannel": false,
      "isCommon": true,
      "is_bus": false,
      "description": "The trigger mode. The options are: ● Attack/release ● Attack/decay ● Looped AD"
    },
    {
      "name": "Time mode",
      "min": 0,
      "max": 2,
      "default": 0,
      "type": "enum",
      "isPerChannel": false,
      "isCommon": true,
      "is_bus": false,
      "description": "The envelope time mode. The options are: ● Macro (asymmetric) ● Macro (symmetric) ● Independent"
    },
    {
      "name": "Joint time",
      "min": 0,
      "max": 1023,
      "default": 0,
      "type": "bus",
      "isPerChannel": false,
      "isCommon": true,
      "is_bus": false,
      "description": "Sets the attack and release times if the ‘Time mode’ is one of the two ‘Macro’ options."
    },
    {
      "name": "Attack time",
      "min": 0,
      "max": 1023,
      "default": 64,
      "type": "bus",
      "isPerChannel": false,
      "isCommon": true,
      "is_bus": false,
      "description": "Sets the attack time if the ‘Time mode’ is ‘Independent’."
    },
    {
      "name": "Release time",
      "min": 0,
      "max": 1023,
      "default": 64,
      "type": "bus",
      "isPerChannel": false,
      "isCommon": true,
      "is_bus": false,
      "description": "Sets the release time if the ‘Time mode’ is ‘Independent’."
    },
    {
      "name": "Attack shape",
      "min": 0,
      "max": 128,
      "default": 104,
      "type": "bus",
      "isPerChannel": false,
      "isCommon": true,
      "is_bus": false,
      "description": "Sets the attack shape, from an exaggerated exponential curve at 0 to an almost linear shape at 128."
    },
    {
      "name": "Release shape",
      "min": 0,
      "max": 128,
      "default": 40,
      "type": "bus",
      "isPerChannel": false,
      "isCommon": true,
      "is_bus": false,
      "description": "Sets the release shape, from an exaggerated exponential curve at 0 to an almost linear shape at 128."
    },
    {
      "name": "Enable",
      "min": 0,
      "max": 1,
      "default": 0,
      "type": "bus",
      "isPerChannel": true,
      "isCommon": false,
      "is_bus": false,
      "description": "Enables the channel."
    },
    {
      "name": "Output mode",
      "min": 0,
      "max": 1,
      "default": 0,
      "type": "bus",
      "isPerChannel": true,
      "isCommon": false,
      "is_bus": false,
      "description": "The standard Add/Replace mode selector as described above."
    },
    {
      "name": "Amplitude",
      "min": -10.0,
      "max": 10.0,
      "default": 8.0,
      "type": "bus",
      "isPerChannel": true,
      "isCommon": false,
      "is_bus": false,
      "description": "Sets the amplitude of the envelope. Note that negative values give an inverted envelope.",
      "unit": "V"
    },
    {
      "name": "Offset",
      "min": -10.0,
      "max": 10.0,
      "default": 0.0,
      "type": "bus",
      "isPerChannel": true,
      "isCommon": false,
      "is_bus": false,
      "description": "Sets a constant voltage offset for the envelope.",
      "unit": "V"
    },
    {
      "name": "MIDI channel",
      "min": 0,
      "max": 16,
      "default": 0,
      "type": "bus",
      "isPerChannel": true,
      "isCommon": false,
      "is_bus": false,
      "description": "The MIDI channel on which notes can trigger the envelope."
    },
    {
      "name": "I2C channel",
      "min": 0,
      "max": 255,
      "default": 1,
      "type": "bus",
      "isPerChannel": true,
      "isCommon": false,
      "is_bus": false,
      "description": "The I2C channel on which notes can trigger the envelope."
    },
    {
      "name": "Note number",
      "min": -1,
      "max": 127,
      "default": -1,
      "type": "bus",
      "isPerChannel": true,
      "isCommon": false,
      "is_bus": false,
      "description": "The MIDI or I2C note number that will trigger the envelope, or ‘-1’ for ‘Any’."
    },
    {
      "name": "Velocity depth",
      "min": 0,
      "max": 100,
      "default": 0,
      "type": "bus",
      "isPerChannel": true,
      "isCommon": false,
      "is_bus": false,
      "description": "The amount by which the trigger velocity affects the envelope scale (applies only to MIDI and I2C).",
      "unit": "%"
    }
  ],
  "input_ports": [
    {
      "name": "Trigger input",
      "description": "Sets the trigger input bus.",
      "isPerChannel": true
    }
  ],
  "output_ports": [
    {
      "name": "Output",
      "description": "Sets the envelope output bus.",
      "isPerChannel": true
    }
  ]
}
